"Un logarithme est une manière d'exprimer combien de fois une base doit être multipliée par elle-même pour obtenir un certain nombre. Soit $x$, $y$ et $z$ des nombres réels strictement positifs qui vérifient le système d'équations suivant :
$$\log_2\left({x \over yz}\right) = {1 \over 2}$$
$$\log_2\left({y \over xz}\right) = {1 \over 3}$$
$$\log_2\left({z \over xy}\right) = {1 \over 4}$$
Alors la valeur de $\left|\log_2(x^4y^3z^2)\right|$ est égale à $\tfrac{m}{n}$, où $m$ et $n$ sont des entiers strictement positifs premiers entre eux. Trouver la somme $m + n$.",33,30,40,25,A
"Soit $O(0,0)$, $A(\frac{1}{2}, 0)$ et $B(0, \frac{\sqrt{3}}{2})$ des points dans le plan cartésien. Soit $\mathcal{F}$ la famille des segments $\overline{PQ}$ de longueur unitaire situés dans le premier quadrant, où $P$ est sur l'axe des abscisses et $Q$ est sur l'axe des ordonnées. En géométrie analytique, on utilise souvent les coordonnées, la formule de distance et des constructions géométriques pour décrire les positions des points et des segments de droite. Il y a un seul point $C$ sur $\overline{AB}$, différent de $A$ et de $B$, qui n'appartient à aucun segment de $\mathcal{F}$ autre que $\overline{AB}$. On a $OC^2 = \frac{p}{q}$, où $p$ et $q$ sont des entiers positifs premiers entre eux. Trouver $p + q$.",21,23,18,15,B
"Jen participe à une loterie où elle doit choisir 4 nombres distincts dans l'ensemble S = {1, 2, 3, ..., 9, 10}. On tire aléatoirement 4 nombres parmi S. Elle gagne un prix si au moins deux des nombres qu'elle a choisis sont parmi les nombres tirés, et elle remporte le gros lot si les quatre nombres qu'elle a choisis sont exactement les nombres tirés. En théorie des probabilités, la probabilité conditionnelle permet de mesurer la probabilité qu'un événement se produise sachant qu'un autre événement s'est déjà produit. Quelle est la valeur de m + n, si la probabilité qu'elle remporte le gros lot sachant qu'elle a gagné un prix est égale à m/n, où m et n sont des entiers positifs premiers entre eux ?",116,102,88,124,A
"Alice et Bob jouent au jeu suivant. Devant eux, il y a une pile de $n$ jetons. Les joueurs jouent à tour de rôle, avec Alice qui commence. À chaque tour, le joueur peut retirer soit $1$ jeton soit $4$ jetons de la pile. Celui qui retire le dernier jeton remporte la partie. L'analyse des positions gagnantes et perdantes dans un jeu de soustraction relève de la théorie des jeux. Trouver le nombre d'entiers positifs $n$ inférieurs ou égaux à $2024$ pour lesquels Bob a une stratégie lui permettant de gagner avec certitude, quelle que soit la façon dont Alice joue. ",809,808,811,810,A
"Huit cercles de rayon $34$ sont tangents les uns aux autres successivement, et deux de ces cercles sont tangents respectivement aux côtés $AB$ et $BC$ du triangle $ABC$. Il est possible de disposer $2024$ cercles de rayon $1$ de la même façon. Le rayon du cercle inscrit dans le triangle $ABC$ peut s'écrire sous la forme $\frac{m}{n}$, où $m$ et $n$ sont des entiers positifs premiers entre eux. Trouvez la valeur de $m + n$. ",212,197,185,205,B
Définir $f(x)=|| x|-\tfrac{1}{2}|$ et $g(x)=|| x|-\tfrac{1}{4}|$. Les fonctions trigonométriques sont des fonctions mathématiques importantes qui décrivent la relation entre les angles et les rapports des côtés d'un triangle rectangle. Calculer le nombre de points d'intersection des courbes représentées par \[y=4 g(f(\sin (2 \pi x))) \quad\text{ et }\quad x=4 g(f(\cos (3 \pi y))).\],390,385,375,360,B
"Chaque sommet d'un octogone régulier est coloré indépendamment en rouge ou en bleu avec une probabilité égale. Un octogone régulier a une symétrie de rotation. La probabilité que l'octogone puisse être tourné de manière à ce que tous les sommets bleus se trouvent aux positions où il y avait initialement des sommets rouges est égale à $\tfrac{m}{n}$, où $m$ et $n$ sont des entiers positifs premiers entre eux. Quelle est la valeur de $m + n$ ?",371,350,360,380,A
"Résoudre une équation consiste à trouver la valeur de l'inconnue qui rend l'équation vraie. Déterminer le nombre de triplets d'entiers non négatifs $(a,b,c)$ tels que $a + b + c = 300$ et $$a^2b + a^2c + b^2a + b^2c + c^2a + c^2b = 6,000,000.$$",400,300,500,601,D
"Il y a des nombres réels $x$ et $y$, tous deux plus grands que 1, tels que $\log_x\left(y^x\right)=\log_y\left(x^{4y}\right)=10$. Un logarithme est une manière d'exprimer combien de fois une base doit être multipliée par elle-même pour obtenir un certain nombre. Trouver la valeur de $xy$.",25,10,20,30,A
"Alice choisit un ensemble $A$ d'entiers positifs. Ensuite, Bob liste tous les ensembles finis non vides $B$ d'entiers positifs tels que l'élément maximum de $B$ appartient à $A$. La liste de Bob comporte 2024 ensembles. Trouver la somme des éléments de $A$.",65,75,45,55,D
Trouver la plus grande valeur possible de la partie réelle de $$ (75+117i)z + \frac{96+144i}{z} $$ lorsque $ z $ est un nombre complexe tel que $ |z|=4 $.,560,520,540,500,C
"Trouvez le nombre de façons de remplir chaque case d'une grille 2x3 avec un chiffre de sorte que la somme des deux nombres obtenus en lisant de gauche à droite soit égale à 999, et la somme des trois nombres obtenus en lisant du haut vers le bas soit égale à 99. La grille ci-dessous est un exemple d'une telle configuration car 8 + 991 = 999 et 9 + 9 + 81 = 99.

$$\begin{array}{|c|c|c|} \hline 0 & 0 & 8 \\ \hline 9 & 9 & 1 \\ \hline \end{array}$$",36,54,45,63,C
"La distance, la vitesse et le temps sont liés par une certaine relation. Chaque matin, Aya fait une promenade de 9 kilomètres puis s'arrête dans un café. Quand elle marche à une vitesse constante de $ s $ kilomètres par heure, la promenade lui prend 4 heures, et ce temps comprend $ t $ minutes passées dans le café. Quand elle marche à $ s + 2 $ kilomètres par heure, la promenade lui prend 2 heures et 24 minutes, et ce temps comprend également $ t $ minutes passées dans le café. Supposons qu'Aya marche à une vitesse de $ s + \frac{1}{2} $ kilomètres par heure. Trouvez le nombre de minutes que prend la promenade, y compris les $ t $ minutes passées dans le café.",180,220,204,240,C
"Soit $N$ le plus grand entier positif composé de quatre chiffres qui a la propriété suivante : chaque fois qu'un de ses chiffres est remplacé par $1$, le nombre résultant est divisible par $7$. Soient $Q$ et $R$ respectivement le quotient et le reste lorsque $N$ est divisé par $1000$. Calculer $Q + R$.",698,701,699,700,C
"Un chemin sur réseau est un trajet sur une grille de points qui va d'un point du réseau à un autre. Considérez les chemins de longueur $16$ qui suivent les lignes pour aller de l'angle inférieur gauche à l'angle supérieur droit sur une grille $8\times 8$. Trouvez le nombre de ces chemins qui changent de direction exactement quatre fois, comme dans les exemples illustrés ci-dessous.",350,320,294,256,C
Soit $p$ le plus petit nombre premier pour lequel il existe un entier positif $n$ tel que $p^{2}$ divise $n^{4}+1$. Un nombre premier est un nombre entier supérieur à 1 qui ne peut être divisé uniformément que par 1 et lui-même. Trouver le plus petit entier positif $m$ tel que $p^{2}$ divise $m^{4}+1$.,100,120,90,110,D
"Un parallélépipède rectangle est une figure solide tridimensionnelle qui a six faces, et chaque face est un rectangle. Soit $\mathcal{B}$ l'ensemble des boîtes rectangulaires dont l'aire totale vaut $54$ et le volume vaut $23$. Soit $r$ le rayon de la plus petite sphère qui peut contenir chacune des boîtes rectangulaires faisant partie de $\mathcal{B}$. La valeur de $r^2$ peut s'exprimer sous la forme $\frac{p}{q}$, où $p$ et $q$ sont des entiers positifs premiers entre eux. Trouver $p + q$.",621,741,701,721,D
Trouvez le nombre de rectangles qui peuvent être construits à l'intérieur d'un dodécagone régulier donné (12-gon) de sorte que chaque côté du rectangle soit situé sur un côté ou sur une diagonale du dodécagone. Une diagonale d'un dodécagone régulier est un segment de droite reliant deux sommets non adjacents. Le schéma ci-dessous montre trois de ces rectangles.,280,340,250,315,D
"Le centre du cercle circonscrit d'un triangle est celui du cercle qui passe par les trois sommets du triangle. Considérons un triangle $\triangle ABC$ dont le centre du cercle circonscrit est le point $O$ et le centre du cercle inscrit est le point $I$, avec $\overline{IA} \perp \overline{OI}$, un rayon du cercle circonscrit égal à $13$ et un rayon du cercle inscrit égal à $6$. Trouver la valeur du produit $AB \cdot AC$.",468,520,390,420,A
"Il existe une collection composée de $25$ jetons blancs identiques et de $25$ jetons noirs identiques. Trouver le nombre de manières de placer certains de ces jetons dans les $25$ cases unitaires d'une grille $5\times5$, de sorte que :

chaque case contienne au plus un jeton ;
tous les jetons situés sur une même ligne, ainsi que tous les jetons situés sur une même colonne, soient de la même couleur ;
tout jeton supplémentaire placé sur la grille violerait au moins l'une des deux conditions précédentes.",902,890,910,920,A
"Un système de numération, ou base, est une manière de représenter les nombres à l'aide d'un ensemble de symboles et de règles. Soit $b \geq 2$ un entier. On considère qu'un entier strictement positif $n$ est $b$\textit{-eautiful} si, lorsqu'on l'écrit en base $b$, il comporte exactement deux chiffres, et la somme de ces deux chiffres est égale à $\sqrt{n}$. Par exemple, $81$ est $13$-eautiful car $81=\underline{6}\underline{3}_{13}$ et $6 + 3=\sqrt{81}$. Trouver le plus petit entier $b \geq 2$ pour lequel il existe plus de dix entiers $b$-eautiful.",220,200,211,230,C
"Soit ABCDEF un hexagone convexe et équilatéral où toutes les paires de côtés opposés sont parallèles. Un hexagone convexe est un polygone à six côtés tel que tous les angles intérieurs sont inférieurs à 180 degrés, et tout segment de droite reliant deux points à l'intérieur de l'hexagone reste entièrement à l'intérieur de celui-ci. Le triangle formé par les prolongements des segments AB, CD et EF a des longueurs de côtés égales à 200, 240 et 300. Trouvez la longueur du côté de l'hexagone.",60,120,100,80,D
"Soient $A$, $B$, $C$ et $D$ des points sur l'hyperbole $\frac{x^2}{20}- \frac{y^2}{24} = 1$ tels que le quadrilatère $ABCD$ soit un losange dont les diagonales se croisent à l'origine. Trouver le plus grand nombre réel qui est inférieur à $BD^2$ pour tous ces losanges. Une hyperbole est une courbe régulière obtenue par l'intersection d'un plan et d'un cône double, où le plan coupe les deux parties du cône. ",460,400,420,480,D
"Une liste composée d'entiers positifs présente les caractéristiques suivantes :

\bullet La somme de tous les éléments de cette liste est égale à 30.

\bullet Le mode unique de cette liste est 9.

\bullet La médiane de cette liste est un entier positif qui n'est pas présent dans la liste elle - même.

Calculer la somme des carrés de tous les éléments de la liste.",216,226,246,236,D
"Parmi les 900 habitants d'Aimeville, 195 ont une bague en diamant, 367 ont un jeu de clubs de golf et 562 ont une bêche de jardin. De plus, chacun des 900 habitants a un sac de bonbons en forme de cœur. Le principe d'inclusion - exclusion est une méthode en mathématiques pour déterminer le nombre d'éléments dans l'union de plusieurs ensembles. Il y a 437 habitants qui ont exactement deux de ces objets, et 234 habitants qui ont exactement trois de ces objets. Trouver le nombre d'habitants d'Aimeville qui ont les quatre objets.",73,90,80,50,A
"Soit un triangle $ABC$ inscrit dans un cercle $\omega$. Soient les droites tangentes au cercle $\omega$ en $B$ et en $C$ qui se rencontrent au point $D$, et soit la droite $\overline{AD}$ qui coupe le cercle $\omega$ en $P$. On sait que $AB = 5$, $BC = 9$ et $AC = 10$. On peut exprimer $AP$ sous la forme $\frac{m}{n}$, où $m$ et $n$ sont des entiers premiers entre eux. Rappelons qu'une tangente à un cercle est une droite qui touche le cercle en exactement un point, et en ce point, la tangente est perpendiculaire au rayon du cercle. Trouver la valeur de $m + n$.",130,113,100,120,B
"Une sphère est un objet tridimensionnel parfaitement rond, semblable à une balle. Le tore $T$ est la surface résultant de la rotation d'un cercle de rayon $3$ autour d'un axe situé dans le plan du cercle et distant de $6$ du centre du cercle (comme une bouée). Soit $S$ une sphère de rayon $11$. Lorsque le tore $T$ est placé à l'intérieur de la sphère $S$, il est tangent intérieurement à $S$ le long d'un cercle de rayon $r_i$, et lorsque le tore $T$ est placé à l'extérieur de la sphère $S$, il est tangent extérieurement à $S$ le long d'un cercle de rayon $r_o$. La différence $r_i - r_o$ peut s'exprimer sous la forme $\frac{m}{n}$, où $m$ et $n$ sont des entiers positifs premiers entre eux. Trouver la valeur de $m + n$.",100,110,127,130,C
"Soit $ABCD$ un tétraèdre avec $AB = CD=\sqrt{41}$, $AC = BD=\sqrt{80}$, et $BC = AD=\sqrt{89}$. Un tétraèdre est une figure tridimensionnelle constituée de quatre faces triangulaires, quatre sommets (ou coins) et six arêtes. Il a l'allure d'une pyramide à base triangulaire. Il y a un point $I$ à l'intérieur du tétraèdre tel que les distances de $I$ à chacune des faces du tétraèdre sont toutes identiques. Cette distance peut s'exprimer sous la forme $\frac{m\sqrt{n}}{p}$, où $m$, $n$ et $p$ sont des entiers positifs, $m$ et $p$ sont premiers entre eux, et $n$ n'est pas divisible par le carré d'un nombre premier. Calculer $m + n + p$.",112,104,98,108,B
"Des rectangles $ABCD$ et $EFGH$ sont tracés de manière à ce que les points $D$, $E$, $C$, $F$ soient alignés. En outre, les points $A$, $D$, $H$, $G$ sont tous situés sur un cercle. Si $BC = 16$, $AB = 107$, $FG = 17$ et $EF = 184$, quelle est la longueur de $CE$ ?",94,104,124,114,B
"Soit $\omega \neq 1$ une racine 13 - ième de l'unité. Qu'est - ce que le reste est lorsqu'on divise  
$$ \prod_{k=0}^{12}(2 - 2\omega^k + \omega^{2k}) $$ par 1000?",456,789,321,123,C
