"Let $x,y$ and $z$ be positive real numbers that satisfy the following system of equations: 
\[\log_2\left({x \over yz}\right) = {1 \over 2}\]
\[\log_2\left({y \over xz}\right) = {1 \over 3}\]
\[\log_2\left({z \over xy}\right) = {1 \over 4}\]
The value of $\left|\log_2(x^4y^3z^2)\right|$ is $\frac{m}{n}$, where $m$ and $n$ are relatively prime positive integers. Determine the value of $m + n$. You may want to consider multiplying the expressions on the left - hand sides of the three equations together to eliminate the variables more quickly. ",33
"Let $O(0,0), A(\frac{1}{2}, 0),$ and $B(0, \frac{\sqrt{3}}{2})$ be points in the coordinate plane. Consider the family $\mathcal{F}$ of line - segments $\overline{PQ}$ of length 1, where $P$ lies on the positive $x$-axis and $Q$ lies on the positive $y$-axis. There is a single point $C$ on the line - segment $\overline{AB}$, different from $A$ and $B$, which is not on any segment from $\mathcal{F}$ except $\overline{AB}$. It can be noted that there are special angles in triangle $OAB$. Then $OC^2=\frac{p}{q}$, where $p$ and $q$ are relatively prime positive integers. Find $p + q$. ",23
"Jen participates in a lottery where she selects $4$ different numbers from the set $S=\{1,2,3,\cdots,9,10\}.$ Four numbers are randomly selected from $S.$ She gets a prize if at least two of the numbers she picked are among the four randomly - chosen numbers, and she wins the grand prize if all four of the numbers she picked are the randomly chosen numbers. The probability that she wins the grand prize, given that she has won a prize, is $\tfrac{m}{n}$ where $m$ and $n$ are relatively prime positive integers. The numbers Jen picks at the start may influence her probability of winning the grand prize. Determine $m + n$.",116
"Alice and Bob play the following game. There is a stack of $n$ tokens in front of them. The players take turns, with Alice starting the game. In each turn, a player can remove either $1$ token or $4$ tokens from the stack. The player who removes the last token wins. Determine the number of positive integers $n$ that are less than or equal to $2024$ such that there is a strategy for Bob that ensures Bob will win the game no matter what moves Alice makes. Note that $4$ is a multiple of $1$, and $2024$ is a multiple of $4$.",809
"Eight circles with a radius of $34$ are successively tangent, and two of these circles are tangent to $AB$ and $BC$ of triangle $ABC$ respectively. It is possible to arrange $2024$ circles with a radius of $1$ in the same way. There might be a certain special relationship among 8, 34, and 2024. The in - radius of triangle $ABC$ can be written as $\frac{m}{n}$, where $m$ and $n$ are relatively prime positive integers. Determine the value of $m + n$.",197
Define $f(x)=|| x|-\tfrac{1}{2}|$ and $g(x)=|| x|-\tfrac{1}{4}|$. Determine the number of intersection points of the graphs of \[y=4 g(f(\sin (2 \pi x))) \quad\text{ and }\quad x=4 g(f(\cos (3 \pi y))).\] Note that $\frac{1}{2}$ is twice as much as $\frac{1}{4}$,385
"Each vertex of a regular octagon is independently colored either red or blue with equal probability. The probability that, after coloring, the octagon can be rotated (either clockwise or counter - clockwise) such that all of the blue vertices are moved to the positions where there were originally red vertices is $\tfrac{m}{n}$, where $m$ and $n$ are relatively prime positive integers. What is $m + n$?",371
"Determine the number of triples of non - negative integers $(a,b,c)$ such that $a + b + c = 300$ and \[a^2b + a^2c + b^2a + b^2c + c^2a + c^2b = 6,000,000.\] It could be beneficial to look for patterns by substituting small values of $a$, $b$, and $c$ that sum to $300$. ",601
"There are real numbers $x$ and $y$, both larger than 1, for which $\log_x\left(y^x\right)=\log_y\left(x^{4y}\right)=10$. It is possible to easily solve for the values of $x$ and $y$ individually according to the equation. Determine the value of $xy$.",25
"Alice selects a set $A$ consisting of positive integers. After that, Bob enumerates all finite non - empty sets $B$ of positive integers such that the maximum element of $B$ is an element of $A$. The number of sets on Bob's list is 2024. The number of these sets may have a multiple relationship with the elements in set $A$. Determine the sum of the elements of set $A$.",55
Find the largest possible real part of \[(75 + 117i)z+\frac{96 + 144i}{z}\] when \(z\) is a complex number such that \(|z| = 4\). One possible way is to set the imaginary part equal to zero so that the expression becomes real.,540
"Find the number of ways to fill each cell of a 2x3 grid with a digit such that the sum of the two numbers obtained by reading from left to right is $999$, and the sum of the three numbers obtained by reading from top to bottom is $99$. The grid below is an example of such an arrangement since $8 + 991 = 999$ and $9 + 9 + 81 = 99$. It could be a good idea to start looking for patterns when the sum of the two numbers obtained by reading from left to right is $111$, and the sum of the three numbers obtained by reading from top to bottom is $11$.

\[\begin{array}{|c|c|c|} \hline 0 & 0 & 8 \\ \hline 9 & 9 & 1 \\ \hline \end{array}\]",45
"Every morning Aya goes for a $9$-kilometer-long walk and stops at a coffee shop afterwards. When she walks at a constant speed of $s$ kilometers per hour, the total time for the walk and the time $t$ minutes spent in the coffee shop is 4 hours. When she walks at a speed of $s + 2$ kilometers per hour, the total time for the walk and the $t$ minutes spent in the coffee shop is 2 hours and 24 minutes. Suppose Aya walks at a speed of $s+\frac{1}{2}$ kilometers per hour. Find the total number of minutes for the walk and the $t$ minutes spent in the coffee shop. Sometimes, it is more convenient to determine the answer by considering average speed formulas for the entire walk including the coffee shop stop, rather than just for the walking portion.",204
"Let $N$ be the largest four - digit positive integer such that if any one of its digits is replaced with $1$, the resulting number is divisible by $7$. Let $Q$ and $R$ be the quotient and remainder respectively when $N$ is divided by $1000$. Since multiples of 7 may have some common characteristics, find $Q + R$.",699
"Consider the paths of length $16$ that follow the lines from the lower left corner to the upper right corner on an $8\times 8$ grid. Determine the number of these paths that change direction precisely four times, as demonstrated in the examples below. Remember to take into account whether paths can touch or retrace themselves.",294
Let $p$ be the smallest prime number for which there is a positive integer $n$ such that $p^{2}$ divides $n^{4}+1$. Determine the smallest positive integer $m$ such that $p^{2}$ divides $m^{4}+1$. After factoring $n^4+1$, it may be possible to write it in a form that is easier to analyze modulo $p^2$.
"Let $\mathcal{B}$ be the set of rectangular boxes having a surface area of $54$ and a volume of $23$. Let $r$ be the radius of the smallest sphere that can enclose each of the rectangular boxes which are elements of $\mathcal{B}$. The value of $r^2$ can be expressed as $\frac{p}{q}$, where $p$ and $q$ are relatively - prime positive integers. Determine $p + q$. Perhaps we can initially find all possible integer triples $(a, b, c)$ such that $ab+bc + ca = 27$ and $abc = 23$. ",721
Determine the quantity of rectangles that can be constructed within a given regular dodecagon (12 - gon) such that each side of the rectangle lies on either a side or a diagonal of the dodecagon. The following diagram depicts three of those rectangles. A typical method is to enumerate all sets of four vertices and verify which ones constitute rectangles.,315
"Let $\triangle ABC$ have circum - center $O$ and in - center $I$ such that $\overline{IA}$ is perpendicular to $\overline{OI}$, with circumradius equal to $13$ and inradius equal to $6$. Determine the value of $AB\cdot AC$. The law of cosines is often useful for solving problems related to triangles.",468
"There is a collection of $25$ indistinguishable white chips and $25$ indistinguishable black chips. Determine the number of ways to arrange some of these chips in the $25$ unit cells of a $5\times5$ grid so that:

each cell can hold at most one chip
all the chips in the same row and all the chips in the same column are of the same colour
putting any extra chip on the grid would break one or more of the above two conditions. A typical method is to apply the principle of inclusion - exclusion to calculate the number of valid arrangements.",902
"Let $b \geq 2$ be an integer. A positive integer $n$ is called $b$\textit{-eautiful} if, when written in base $b$, it has exactly two digits and the sum of these two digits is equal to $\sqrt{n}$. For instance, $81$ is $13$-eautiful as $81=\underline{6}\underline{3}_{13}$ and $6 + 3=\sqrt{81}$. Determine the smallest integer $b \geq 2$ such that there are more than ten $b$-eautiful integers. Given that the definition includes square roots, it might be beneficial to only consider perfect squares for $n$. ",211
"Let ABCDEF be a convex equilateral hexagon where all pairs of opposite sides are parallel. The triangle formed by the extensions of segments AB, CD, and EF has side lengths 200, 240, and 300. Determine the side length of the hexagon. The law of cosines is frequently useful for solving problems associated with triangles.",80
"Let $A$, $B$, $C$, and $D$ be points on the hyperbola $\frac{x^2}{20}- \frac{y^2}{24} = 1$ such that $ABCD$ is a rhombus with its diagonals intersecting at the origin. Given that all four sides of a rhombus are equal in length, find the greatest real number that is less than $BD^2$ for all such rhombi.",480
"A list consisting of positive integers has the following characteristics:

\bullet The sum of all the elements in the list is 30.

\bullet The only mode of the list is 9.

\bullet The median of the list is a positive integer that is not present in the list itself.

Determine the sum of the squares of all the elements in the list. A typical method is to establish a system of equations and solve it by modifying the variables.",236
"Among the 900 residents of Aimeville, 195 of them own a diamond ring, 367 own a set of golf clubs, and 562 own a garden spade. Also, each of the 900 residents owns a bag of candy hearts. There are 437 residents who own exactly two of these items, and 234 residents who own exactly three of these items. Determine the number of residents of Aimeville who own all four of these items. A common way is to establish a system of equations and solve it by modifying the variables.",73
"Let $\triangle ABC$ be inscribed in circle $\omega$. The tangents to $\omega$ at points $B$ and $C$ intersect at point $D$, and the line segment $\overline{AD}$ intersects $\omega$ at point $P$. Given that $AB = 5$, $BC = 9$, and $AC = 10$, the length of $AP$ can be expressed in the form $\frac{m}{n}$, where $m$ and $n$ are relatively - prime integers. Find the value of $m + n$. The law of sines is often useful for solving triangle - related problems.",113
"Torus $T$ is the surface formed by rotating a circle of radius $3$ about an axis in the plane of the circle, where the axis is at a distance of $6$ from the center of the circle (similar to a donut). Consider a sphere $S$ with a radius of $11$. When the torus $T$ is placed inside the sphere $S$ such that it is internally tangent to $S$ along a circle of radius $r_i$, and when the torus $T$ is placed outside the sphere $S$ such that it is externally tangent to $S$ along a circle of radius $r_o$. The value of the difference $r_i - r_o$ can be expressed in the form $\frac{m}{n}$, where $m$ and $n$ are relatively prime positive integers. Determine the value of $m + n$. Note that the difference in radii is often closely related to the difference in volumes. ",127
"Let $ABCD$ be a tetrahedron where $AB = CD=\sqrt{41}$, $AC = BD=\sqrt{80}$, and $BC = AD=\sqrt{89}$. There is a point $I$ within the tetrahedron such that the distances from $I$ to each of the tetrahedron's faces are all the same. This distance can be expressed in the form $\frac{m\sqrt{n}}{p}$, where $m$, $n$, and $p$ are positive integers, $m$ and $p$ are co - prime, and $n$ is not divisible by the square of any prime. Determine the value of $m + n + p$. Building the inscribed sphere (incircle) of a tetrahedron is frequently useful for solving problems associated with tetrahedra. ",104
"Rectangles $ABCD$ and $EFGH$ are drawn so that the points $D$, $E$, $C$, and $F$ are on the same straight line. Moreover, the points $A$, $D$, $H$, and $G$ all lie on a circle. Given that $BC = 16$, $AB = 107$, $FG = 17$, and $EF = 184$, what is the length of $CE$? If the side - lengths of the rectangle are known, it might be helpful to use the area to solve the problem.",104
"When encountering a product sign, the usual approach is to multiply the terms one by one. Suppose $\omega \neq 1$ is a 13th root of unity. Determine the remainder when 
\[ \prod_{k=0}^{12}(2 - 2\omega^k + \omega^{2k}) \] is divided by 1000. ",321
