"Let $x,y$ and $z$ be positive real - numbers that fulfill the following system of equations: 
\[\log_2\left({x \over yz}\right) = {1 \over 2}\]
\[\log_2\left({y \over xz}\right) = {1 \over 3}\]
\[\log_2\left({z \over xy}\right) = {1 \over 4}\]
Then the absolute value of $\log_2(x^{461}y^3z^2)$ is $\frac{m}{n}$, where $m$ and $n$ are relatively prime positive integers. Determine the value of $m + n$.",1649
请你明确题目相关的完整信息，仅“x”无法进行题目改写。,x
"Jen enters a lottery by selecting $4$ distinct numbers from the set $S = \{1,2,3,\cdots,105,106\}$. Four numbers are randomly selected from the set $S$. She wins a prize if at least two of the numbers she picked are among the four randomly - chosen numbers, and she wins the grand prize if all four of the numbers she picked are the randomly - chosen numbers. The probability that she wins the grand prize, given that she has won a prize, is $\frac{m}{n}$, where $m$ and $n$ are relatively prime positive integers. Determine the value of $m + n$.",31316
"Alice and Bob play the following game. There is a stack of $n$ tokens in front of them. The players take turns, with Alice starting first. In each turn, the player can remove either $1$ token or $4$ tokens from the stack. The player who removes the last token wins. Determine the number of positive integers $n$ that are less than or equal to $435$ for which there is a strategy for Bob that ensures Bob will win the game no matter what moves Alice makes.",174
"Eight circles with a radius of $55$ are successively tangent, and two of these circles are tangent to sides $AB$ and $BC$ of triangle $ABC$ respectively. It is possible to arrange $2024$ circles with a radius of $1$ in the same way. The in - radius of triangle $ABC$ can be written in the form $\frac{m}{n}$, where $m$ and $n$ are relatively prime positive integers. Determine the value of $m + n$.",893
Define $f(x)=|| x|-\frac{1}{2}|$ and $g(x)=|| x|-\frac{1}{4}|$. Determine the number of intersection points of the graphs of \[y = 4 g(f(\sin (2 \pi x))) \quad\text{and}\quad x = 4 g(f(\cos (570 \pi y))).\],72961
"Each vertex of a regular decagon is independently colored either red or blue with equal probability. The probability that, after coloring, the decagon can be rotated in such a way that all blue vertices are moved to the positions where there were originally red vertices is $\tfrac{m}{n}$, where $m$ and $n$ are relatively prime positive integers. What is $m + n$?",681
请你提供完整的题目内容，仅“x”无法完成改写。,x
"There are real - valued numbers $x$ and $y$, both larger than 1, for which $\log_x\left(y^x\right)=\log_y\left(x^{4y}\right)=228$. Determine the value of $xy$.",12996
"Alice selects a set $A$ consisting of positive integers. Subsequently, Bob enumerates all finite non - empty sets $B$ of positive integers such that the maximum element of $B$ is an element of $A$. The number of sets on Bob's list is 437. Determine the sum of the elements of $A$.",32
Find the largest possible real part of \[(39 + 117i)z+\frac{96 + 144i}{z}\] when \(z\) is a complex number such that \(|z| = 4\).,468
"Determine the number of ways to fill each cell of a 2x3 grid with a digit such that the sum of the two numbers obtained by reading from left to right is $999$, and the sum of the three numbers obtained by reading from top to bottom is $72$. The grid below serves as an example of such an arrangement since $5+994=999$ and $9+9+54=72$. \[\begin{array}{|c|c|c|} \hline 0 & 0 & 5 \\ \hline 9 & 9 & 4 \\ \hline \end{array}\]",21
"Every morning Aya goes for a $1$-kilometer-long walk and then stops at a coffee shop. If she walks at a constant speed of $s$ kilometers per hour, the entire process (the walk and the time spent in the coffee shop) takes her 4 hours, with $t$ minutes being the time she spends in the coffee shop. When she walks at a speed of $s + 2$ kilometers per hour, the whole thing (the walk and the time in the coffee shop) takes her 2 hours and 24 minutes, where the time spent in the coffee shop is still $t$ minutes. Assume Aya walks at a speed of $s+\frac{1}{2}$ kilometers per hour. Determine the number of minutes the entire process (the walk and the $t$ - minute stay in the coffee shop) takes her. ",180
"Let $N$ be the largest four - digit positive integer such that if any one of its digits is changed to $1$, the resulting number is divisible by $7$. Let $Q$ and $R$ be the quotient and remainder respectively when $N$ is divided by $504$. Find $Q + R$.",161
"Consider the paths of length $16$ that move along the lines from the bottom - left corner to the top - right corner on an $8\times 8$ grid. Determine the number of these paths that change direction precisely eight times, as demonstrated in the examples below.",2450
Let $p$ be the smallest prime number for which there is a positive integer $n$ such that $p^{1}$ divides $n^{4}+1$. Find the smallest positive integer $m$ such that $p^{1}$ divides $m^{4}+1$.,1
"Let $\mathcal{B}$ be the set of rectangular - shaped boxes having a surface area of $58$ and a volume of $23$. Let $r$ be the radius of the smallest sphere that is capable of enclosing each of the rectangular boxes which are members of $\mathcal{B}$. The value of $r^2$ can be written in the form $\frac{p}{q}$, where $p$ and $q$ are relatively prime positive integers. Determine the value of $p + q$.",12310062237
"Determine the quantity of rectangles that can be constructed within a given regular hexadecagon (16 - gon), with each side of the rectangle being either a side or a diagonal of the hexadecagon. The following diagram presents three such rectangles.",1344
"Given a triangle $\triangle ABC$ with circum - center $O$ and in - center $I$, where $\overline{IA}$ is perpendicular to $\overline{OI}$, the circum - radius is $33$, and the in - radius is $6$. Calculate the value of $AB\cdot AC$.",1188
"There exists a set of 88 identical white chips and 25 identical black chips. Determine the number of ways to arrange some of these chips in the 25 unit - squares of a 5×5 grid so that:
each square can hold at most one chip;
all chips in the same row and all chips in the same column are of the same color;
placing any extra chip on the grid would break one or more of the above two rules.",902
"Let $b \geq 2$ be an integer. A positive integer $n$ is called $b$\textit{-eautiful} if, when written in base $b$, it has exactly two digits and the sum of these two digits is equal to $\sqrt{n}$. For instance, $81$ is $13$-eautiful since $81=\underline{6}\underline{3}_{13}$ and $6 + 3=\sqrt{81}$. Determine the smallest integer $b \geq 2$ such that there are more than 25 $b$-eautiful integers.",2311
请你明确一下关于“x”这道题的完整信息，比如它在一个什么样的题目情境中，是方程里的未知数，还是其他相关的题目，以便我按照要求进行改写。,x
"Let $A$, $B$, $C$, and $D$ be points on the hyperbola $\frac{x^2}{23}- \frac{y^2}{24} = 1$. Suppose $ABCD$ is a rhombus with its diagonals intersecting at the origin. Determine the greatest real number that is smaller than $BD^2$ for every such rhombus.",2208
"A list consisting of positive integers has the following characteristics:

\bullet The total of the elements in the list is 25.

\bullet The sole mode of the list is 9.

\bullet The median of the list is a positive integer that is not present in the list.

Determine the sum of the squares of all the elements in the list.",191
"Among the 900 residents of Aimeville, 537 residents own a diamond ring, 367 residents own a set of golf clubs, and 562 residents own a garden spade. Also, each of the 900 residents owns a bag of candy hearts. There are 437 residents who own exactly two of these items, and 234 residents who own exactly three of these items. Determine the number of residents of Aimeville who own all four of these items.",187
"Let $\triangle ABC$ be inscribed in circle $\omega$. The tangents to circle $\omega$ at points $B$ and $C$ intersect at point $D$, and the line segment $\overline{AD}$ intersects circle $\omega$ at point $P$. Given that $AB = 5$, $BC = 13$, and $AC = 10$, if the length of $AP$ is expressed in the form $\frac{m}{n}$ where $m$ and $n$ are relatively - prime integers, find the value of $m + n$.",109
"Torus $T$ is the surface formed by rotating a circle of radius $1$ about an axis in the plane of the circle that is at a distance of $6$ from the center of the circle (similar to a donut). Consider a sphere $S$ with a radius of $11$. When the torus $T$ is placed inside the sphere $S$ such that they are internally tangent, the radius of the circle of tangency is $r_i$. When the torus $T$ is placed outside the sphere $S$ such that they are externally tangent, the radius of the circle of tangency is $r_o$. The difference between $r_i$ and $r_o$ can be expressed in the form $	frac{m}{n}$, where $m$ and $n$ are relatively prime positive integers. Determine the value of $m + n$.",21
"Let $ABCD$ be a tetrahedron with $AB = CD=\sqrt{41}$, $AC = BD=\sqrt{114}$, and $BC = AD=\sqrt{89}$. There is a point $I$ within the tetrahedron for which the distances from $I$ to each of the tetrahedron's faces are all the same. This distance can be expressed as $\frac{m\sqrt{n}}{p}$, where $m$, $n$, and $p$ are positive integers, $m$ and $p$ are co - prime, and $n$ is not divisible by the square of any prime number. Determine the value of $m + n + p$.",27494
"Rectangles $ABCD$ and $EFGH$ are drawn so that the points $D$, $E$, $C$, and $F$ are on the same straight line. Moreover, the points $A$, $D$, $H$, and $G$ all lie on a circle. Given that $BC = 16$, $AB = 107$, $FG = 77$, and $EF = 184$, what is the length of $CE$?",74
"Let $\omega \neq 1$ be a 13th root of unity. Determine the remainder when the product 
\[ \prod_{k=0}^{12}(2 - 2\omega^k + \omega^{2k}) \] is divided by 617.",300
